comment_id,post_id,subreddit,comment_author,comment_body,comment_score,comment_created_utc,text,special_char_ratio,word_count,unique_word_count,sentiment
lvhbsfh,1gjlnve,applestocks,InvestmentGems,Which company will be the first to reach 4 Trillion Market Cap? 💰,1,1730785786.0,Which company will be the first to reach 4 Trillion Market Cap? 💰,0.0307692307692307,13,13,Neutral
lvikzmo,1gjlnve,applestocks,LordOfPraise,The CUDA moat will hold for many years ahead. The GPU options of their competitors are still not even close to being competitive and won’t be the next 5 years. The GPU options currently available from competitors can only be used for smaller tasks.,1,1730812043.0,The CUDA moat will hold for many years ahead. The GPU options of their competitors are still not even close to being competitive and won’t be the next 5 years. The GPU options currently available from competitors can only be used for smaller tasks.,0.0161290322580645,44,37,Positive
lurtgpe,1ggozio,applestocks,AngAntRy,Minor set back for a major come back. The market is super volatile right now. With elections and the nice bull run we’ve been having. Nothing to be alarmed by.,8,1730414964.0,Minor set back for a major come back. The market is super volatile right now. With elections and the nice bull run we’ve been having. Nothing to be alarmed by.,0.0314465408805031,30,30,Positive
lusndzt,1ggozio,applestocks,nimbusthegreat,Seems like many people have short memories. I’ve been following their stock long enough to remember a time when Apple could announce they had developed the cure for cancer and their stock would dip in response. 🤣,2,1730426401.0,Seems like many people have short memories. I’ve been following their stock long enough to remember a time when Apple could announce they had developed the cure for cancer and their stock would dip in response. 🤣,0.0188679245283018,37,35,Positive
luroivq,1ggozio,applestocks,VonGeisler,New? Standard earnings action.,1,1730413104.0,New? Standard earnings action.,0.0666666666666666,4,4,Neutral
lurz3zk,1ggozio,applestocks,da7idwalsh,People that don’t understand AI 🤖 or have not tried Apple Intelligence) are spooked (because its that time 👻 of year),1,1730417117.0,People that don’t understand AI 🤖 or have not tried Apple Intelligence) are spooked (because its that time 👻 of year),0.0512820512820512,21,20,Negative
lurtt6t,1ggozio,applestocks,Unknown,I’m thinking it’s like a rubber band pull back getting ready to fire off to the moon 🤣,2,1730415096.0,I’m thinking it’s like a rubber band pull back getting ready to fire off to the moon 🤣,0.0348837209302325,18,17,Positive
lurp1sk,1ggozio,applestocks,Unknown,It was with Nvidia but this went before the earnings call today.,1,1730413302.0,It was with Nvidia but this went before the earnings call today.,0.015625,12,12,Neutral
lurzbjz,1ggozio,applestocks,Unknown,Legit and most likely reason 🤣,1,1730417197.0,Legit and most likely reason 🤣,0.0333333333333333,6,6,Positive
luve754,1ggozio,applestocks,North_Cherry,"Better be that, I put my college funds into that",2,1730475346.0,"Better be that, I put my college funds into that",0.0208333333333333,10,10,Positive
low2yfu,1fjs1zz,applestocks,interstellar_freak,"Apple will be Nokia if it keeps releasing product with just a button and same specs. 

Sam Altman and Jone Ivey teaming up for new product.",2,1727287030.0,"Apple will be Nokia if it keeps releasing product with just a button and same specs. 

Sam Altman and Jone Ivey teaming up for new product.",0.014388489208633,26,25,Neutral
lnqei1w,1fjs1zz,applestocks,No-Conclusion8653,$275 this year!,1,1726667350.0,$275 this year!,0.1333333333333333,3,3,Neutral
lnrcjdq,1fjs1zz,applestocks,Icycall,"They are looking well. Tons of cash from business, only losing cash from paying dividends and buying back stock.",2,1726678358.0,"They are looking well. Tons of cash from business, only losing cash from paying dividends and buying back stock.",0.0267857142857142,19,17,Negative
lo1m4iu,1faf0yc,applestocks,NotYourTypicalGuy88,"RIght now its $229 with a PT of $275, do you think there will be a bit of a sell off due to new phone release today?",1,1726837143.0,"RIght now its $229 with a PT of $275, do you think there will be a bit of a sell off due to new phone release today?",0.0344827586206896,27,24,Neutral
lo1mze5,1faf0yc,applestocks,Active_Reason_2852,"...i think it already happened... not sure anymore about short term downside, the bigger iphone being released sorta worries me, i exited most of my puts already, i dont plan on betting against apple long term yet.",1,1726837478.0,"...i think it already happened... not sure anymore about short term downside, the bigger iphone being released sorta worries me, i exited most of my puts already, i dont plan on betting against apple long term yet.",0.0467289719626168,37,35,Negative
lllpzig,1f9gayt,applestocks,lukeyboots,"Buy it at $16 in 2012 and HODL till now like I did. 🙏😉

They predicted $275 when it hit $237 back in July. You should have jumped on it when it dipped to $207 a few weeks ago.

It’s a good buy now or at a lower price. Looks like it’ll dip under $220 a bit more before it rises again. Investors always get underwhelmed by the new iPhone announcement. But hey, it’s Apple mate, it ain’t going anywhere. Buy now and hold long.",4,1725528469.0,"Buy it at $16 in 2012 and HODL till now like I did. 🙏😉

They predicted $275 when it hit $237 back in July. You should have jumped on it when it dipped to $207 a few weeks ago.

It’s a good buy now or at a lower price. Looks like it’ll dip under $220 a bit more before it rises again. Investors always get underwhelmed by the new iPhone announcement. But hey, it’s Apple mate, it ain’t going anywhere. Buy now and hold long.",0.0496453900709219,85,69,Positive
m17ryj7,1f9gayt,applestocks,Pharmercist420,Got in at 130 in 2021 been holding,1,1733762619.0,Got in at 130 in 2021 been holding,0.0,8,7,Neutral
llm0y5s,1f9gayt,applestocks,afinitie,Every single time people I know go “oh bro the new iPhone announcement now’s the time to buy” and it dips when the iPhone comes out,5,1725534968.0,Every single time people I know go “oh bro the new iPhone announcement now’s the time to buy” and it dips when the iPhone comes out,0.0229007633587786,26,22,Neutral
lllrg14,1f9gayt,applestocks,No-Conclusion8653,"""Sherman, start up the Way Back Machine!"" ÷)

Thanks!",3,1725529466.0,"""Sherman, start up the Way Back Machine!"" ÷)

Thanks!",0.1320754716981132,9,9,Positive
llm2s1v,1f9gayt,applestocks,lukeyboots,Just classic expectation & over confidence.,2,1725535872.0,Just classic expectation & over confidence.,0.0465116279069767,6,6,Positive
llm9n9t,1f9gayt,applestocks,No-Conclusion8653,"So, Obi-Wan, will you give your new Padawan a hint at a buy price? This will be my second stock purchase in my 74 years ÷)",1,1725538941.0,"So, Obi-Wan, will you give your new Padawan a hint at a buy price? This will be my second stock purchase in my 74 years ÷)",0.0491803278688524,26,23,Neutral
llmblbi,1f9gayt,applestocks,lukeyboots,"I think buying a stock because an analyst said it’s going higher is a bad reason to buy a stock.

Other equally respected analysts have given Apple a price target of $175.

I own the stock cause I believe in the company & its solid financials and quality of product, ability to generate revenue from services etc.

If it goes to $275, awesome, I’ll definitely sell a portion and take some profit.

If it drops to $190 by Christmas? No worries, just hold for another year or 5.

If you’re looking to make some money, put it into a a broad based growth ETF. Although at your age, I’d be going more defensive/passive income stuff.",2,1725539749.0,"I think buying a stock because an analyst said it’s going higher is a bad reason to buy a stock.

Other equally respected analysts have given Apple a price target of $175.

I own the stock cause I believe in the company & its solid financials and quality of product, ability to generate revenue from services etc.

If it goes to $275, awesome, I’ll definitely sell a portion and take some profit.

If it drops to $190 by Christmas? No worries, just hold for another year or 5.

If you’re looking to make some money, put it into a a broad based growth ETF. Although at your age, I’d be going more defensive/passive income stuff.",0.036682615629984,115,93,Positive
llpo3f6,1f9gayt,applestocks,Either-West-711,Dun buy. You missed the boat even if it’s your amusement money you’re playing with.,2,1725579720.0,Dun buy. You missed the boat even if it’s your amusement money you’re playing with.,0.0481927710843373,15,15,Positive
llmhb8h,1f9gayt,applestocks,No-Conclusion8653,"I'm 74, I'm 100% cash, except for a few I bonds÷) This is my amusement money. I was *quite*  amused at my first ever stock purchase of the RDDT IPO ÷) 

Now about that price . . . I absolutely have to do something with this upcoming RMD., and my grandchildren already have enough! ÷)",1,1725541971.0,"I'm 74, I'm 100% cash, except for a few I bonds÷) This is my amusement money. I was *quite*  amused at my first ever stock purchase of the RDDT IPO ÷) 

Now about that price . . . I absolutely have to do something with this upcoming RMD., and my grandchildren already have enough! ÷)",0.0706713780918728,55,46,Positive
llmj6eb,1f9gayt,applestocks,VonGeisler,Apple won’t give you quick returns. It’s a slow moving beast. I have been holding for 15+ years. Reinvesting dividends and selling some on big gains.,3,1725542650.0,Apple won’t give you quick returns. It’s a slow moving beast. I have been holding for 15+ years. Reinvesting dividends and selling some on big gains.,0.046979865771812,26,26,Positive
llo0bxd,1f9gayt,applestocks,No-Conclusion8653,The pater lived to '91. I'm just getting started ÷),1,1725560107.0,The pater lived to '91. I'm just getting started ÷),0.0980392156862745,10,10,Neutral
llgs0rv,1f8l8q5,applestocks,VonGeisler,The whole market was down.,1,1725457474.0,The whole market was down.,0.0384615384615384,5,5,Neutral
lkt63ow,1f42xe4,applestocks,lukeyboots,"If you think Apple will hit $230 just buy it when it was $207 2 weeks ago dude.

If you’re long on a stock just buy it. No chance of blow back if it drops. You just hold until it rises again, as Apple always does.",3,1725097991.0,"If you think Apple will hit $230 just buy it when it was $207 2 weeks ago dude.

If you’re long on a stock just buy it. No chance of blow back if it drops. You just hold until it rises again, as Apple always does.",0.0375586854460093,46,38,Negative
lki555q,1f42xe4,applestocks,Thick_Expression_796,Apple is a good stock for option plays always does good for me 🤷‍♂️,2,1724939817.0,Apple is a good stock for option plays always does good for me 🤷‍♂️,0.0597014925373134,14,12,Positive
lkl1dm4,1f42xe4,applestocks,Syonoq,What’s the date?,1,1724972392.0,What’s the date?,0.125,3,3,Neutral
lkt6748,1f42xe4,applestocks,lukeyboots,Case in point. I bought APPL back in 2012 and kept DCA’ing. First buys were at $16-17. That’s how you make money kids.,2,1725098057.0,Case in point. I bought APPL back in 2012 and kept DCA’ing. First buys were at $16-17. That’s how you make money kids.,0.0677966101694915,23,22,Neutral
ljrvoff,1f0du6x,applestocks,Thick_Expression_796,Don’t stand in front of a moving train.,2,1724539179.0,Don’t stand in front of a moving train.,0.0512820512820512,8,8,Neutral
lg0opkn,1eh7xkf,applestocks,Unknown,"We're already negotiating with HIMARS and DJIs regard

And the league of nations died decades ago

What's next return to the gold standard?",1,1722538163.0,"We're already negotiating with HIMARS and DJIs regard

And the league of nations died decades ago

What's next return to the gold standard?",0.0215827338129496,23,22,Negative
lh8bni1,1eh7xkf,applestocks,Keithmakeithappen,Yuh let’s kill the power so the criminals can fawk us up in the dark,1,1723180594.0,Yuh let’s kill the power so the criminals can fawk us up in the dark,0.0147058823529411,15,13,Negative
ldrg6nl,1e68x6c,applestocks,LordOfPraise,"Apple went bad like every other tech stock because Trump decided to open his mouth. Just bad timing for you, mate.",4,1721305866.0,"Apple went bad like every other tech stock because Trump decided to open his mouth. Just bad timing for you, mate.",0.0263157894736842,21,20,Negative
ldray2f,1e68x6c,applestocks,Support_silver_,"Will very much depend on their results, one bad day does not change everything but they have already gone up quite a lot.",2,1721303473.0,"Will very much depend on their results, one bad day does not change everything but they have already gone up quite a lot.",0.0165289256198347,23,23,Negative
ldrxy21,1e68x6c,applestocks,Strange-Industry2923,I haven't seen the other tech stocks but it's blows. At least it was extra money after bills were paid. Just gotta wait another 2 weeks to eat 🤣,1,1721312682.0,I haven't seen the other tech stocks but it's blows. At least it was extra money after bills were paid. Just gotta wait another 2 weeks to eat 🤣,0.0347222222222222,29,29,Positive
ldtvgnc,1e68x6c,applestocks,Strange-Industry2923,I sold them I wasn't happy with the losses but I dumped the scraps into nvda.,2,1721335473.0,I sold them I wasn't happy with the losses but I dumped the scraps into nvda.,0.0259740259740259,16,13,Negative
ldtgbdg,1e68x6c,applestocks,LordOfPraise,Google “Trump’s comment about Taiwan having to pay the US for military aid against China”,1,1721330564.0,Google “Trump’s comment about Taiwan having to pay the US for military aid against China”,0.0337078651685393,15,15,Negative
ldtvwsd,1e68x6c,applestocks,mizzlestix,This is the way.,2,1721335616.0,This is the way.,0.0625,4,4,Neutral
lcsh30t,1e0wwlf,applestocks,BiggieAndTheStooges,Anyone know wtf just happened?,3,1720760495.0,Anyone know wtf just happened?,0.0333333333333333,5,5,Negative
lcrdoj9,1e0wwlf,applestocks,Ext80,Just keep buying,3,1720743515.0,Just keep buying,0.0,3,3,Neutral
lcq8yu8,1e0wwlf,applestocks,Thick_Expression_796,Supper ruff day today,0,1720729066.0,Supper ruff day today,0.0,4,4,Neutral
lb4xsjn,1dsttbm,applestocks,AngAntRy,Yes! Then again on Red days.,1,1719846670.0,Yes! Then again on Red days.,0.0714285714285714,6,6,Positive
ladh08o,1dozxif,applestocks,Amazing_Structure55,"I think it is just pumping. What AI is going to bring more people to buy iPhones? Unless it cooks, I Will pass",2,1719414770.0,"I think it is just pumping. What AI is going to bring more people to buy iPhones? Unless it cooks, I Will pass",0.0272727272727272,23,19,Neutral
laepf9s,1dozxif,applestocks,MagicianCharacter626,When? It seems to keep going up a little then down!,1,1719429459.0,When? It seems to keep going up a little then down!,0.0392156862745098,11,11,Neutral
lchsmth,1dozxif,applestocks,worldtrekkerdc,It's well on its way getting there.,1,1720610015.0,It's well on its way getting there.,0.0571428571428571,7,7,Positive
lafk3mn,1dozxif,applestocks,CatOrTiger-2022,Baby steps. Slow and steady,3,1719439529.0,Baby steps. Slow and steady,0.037037037037037,5,5,Neutral
l9ob7wt,1dlep4u,applestocks,jaddk522,Do yourself a favor. Sell and stop playing options 😂,12,1719004803.0,Do yourself a favor. Sell and stop playing options 😂,0.0384615384615384,10,10,Positive
l9ofufe,1dlep4u,applestocks,sahilkhurana221,"hey, don't discourage like that. I lost 99.02% on my first day too but then made it back plus 60% more and it's only been a week. OP should invest only what he would be ok to lose tho, especially in the beginning.",1,1719006514.0,"hey, don't discourage like that. I lost 99.02% on my first day too but then made it back plus 60% more and it's only been a week. OP should invest only what he would be ok to lose tho, especially in the beginning.",0.0469483568075117,43,42,Negative
l9ry83c,1dlep4u,applestocks,jaddk522,"Listen, I've been doing this a lot longer than a week. There has to be a strategy when buying options. You shouldn't encourage someone to buy otm leaps. 😂😂",1,1719071136.0,"Listen, I've been doing this a lot longer than a week. There has to be a strategy when buying options. You shouldn't encourage someone to buy otm leaps. 😂😂",0.0516129032258064,29,26,Positive
la18vb6,1dlep4u,applestocks,Jonathankoh1971,"They’re not leaps for the year 2026 worth over $1300 per contract which can be rolled, but a single option expiring next month with a high strike OTM worth $8 off the bid… all he can do is hope the now lottery ticket contract can be sold before expiration for a nominal payout. or pray that the SP get to and over the strike Px over $52 above the current SP. he’s got no choice but to wait and hope or … being gutsy roll them for a weekly ( way less time but way lower strike price)",2,1719228344.0,"They’re not leaps for the year 2026 worth over $1300 per contract which can be rolled, but a single option expiring next month with a high strike OTM worth $8 off the bid… all he can do is hope the now lottery ticket contract can be sold before expiration for a nominal payout. or pray that the SP get to and over the strike Px over $52 above the current SP. he’s got no choice but to wait and hope or … being gutsy roll them for a weekly ( way less time but way lower strike price)",0.0248962655601659,98,72,Positive
l9e00by,1diff2z,applestocks,Informal-Pound-3393,What work have you put in to make this statement?,2,1718841728.0,What work have you put in to make this statement?,0.0204081632653061,10,10,Neutral
l8jad8k,1dee5ls,applestocks,stevenjklein,"Nice!

I only buy calls.  Here's what I'm currently holding:

|Qty & Contract|date purchased|change|
|:-|:-|:-|
|**five** Jan-17-2025 $195|Jan 2nd|+81.17%|
|**ten** AAPL Mar-21-2025 $200|Feb 20th|+122.35%|
|**five** Jan-16-2026 $185|April 22nd|+155.55%|

(I sometimes have losers, but I don't come here to brag about them!)",1,1718339877.0,"Nice!

I only buy calls.  Here's what I'm currently holding:

|Qty & Contract|date purchased|change|
|:-|:-|:-|
|**five** Jan-17-2025 $195|Jan 2nd|+81.17%|
|**ten** AAPL Mar-21-2025 $200|Feb 20th|+122.35%|
|**five** Jan-16-2026 $185|April 22nd|+155.55%|

(I sometimes have losers, but I don't come here to brag about them!)",0.2074303405572755,41,39,Negative
l8csgvn,1ddkv78,applestocks,captclearleft,"Apple AI = Siri = Fail... Another bust from Apple just like that vision pro thing...
 
love the AAPL movement... but pppppaaaalllleeeeaaassseeee 😅🤦😅


Iphone 14 is just a 13 Pro, 15 is just a 14 Pro ...

Apple Vision Pro ... please - bust

They're new idea is ... what... This company needs new ideas an new leadership. 


Can't wait for AI Siri, just stupid!",1,1718238979.0,"Apple AI = Siri = Fail... Another bust from Apple just like that vision pro thing...
 
love the AAPL movement... but pppppaaaalllleeeeaaassseeee 😅🤦😅


Iphone 14 is just a 13 Pro, 15 is just a 14 Pro ...

Apple Vision Pro ... please - bust

They're new idea is ... what... This company needs new ideas an new leadership. 


Can't wait for AI Siri, just stupid!",0.0919220055710306,65,48,Positive
l850ie5,1ddhye1,applestocks,VonGeisler,Every year it continues to break its ATH. I’ve been holding for 20 years and reinvesting dividends.,5,1718124293.0,Every year it continues to break its ATH. I’ve been holding for 20 years and reinvesting dividends.,0.0303030303030303,17,17,Neutral
l86rbl6,1ddhye1,applestocks,joeshleb,"Holding is the only smart move with Apple IMO.  I strongly suspect that Apple is going to pull-off something huge!  Developing AI to new heights, integrating AI with their VisionPro and developing an Apple EV, briming with AI technology.  Apple will be over $300.00, inside of two years.  Then, hopefully, a robust split.",2,1718145564.0,"Holding is the only smart move with Apple IMO.  I strongly suspect that Apple is going to pull-off something huge!  Developing AI to new heights, integrating AI with their VisionPro and developing an Apple EV, briming with AI technology.  Apple will be over $300.00, inside of two years.  Then, hopefully, a robust split.",0.0404984423676012,53,44,Positive
l886mzd,1ddhye1,applestocks,Opposite_Steak_4032,Hold It's going to be a great year for Apple,1,1718168329.0,Hold It's going to be a great year for Apple,0.0227272727272727,10,10,Positive
l887bcq,1ddhye1,applestocks,Opposite_Steak_4032,"They won't split at $300.00.  Would have to over double that to split again.  But they do have The Power To Be The Best!  Not always first but always a Superior Product, for their  large market share of Brand loyal consumers.",1,1718168715.0,"They won't split at $300.00.  Would have to over double that to split again.  But they do have The Power To Be The Best!  Not always first but always a Superior Product, for their  large market share of Brand loyal consumers.",0.0355555555555555,41,36,Positive
l84vie3,1ddhye1,applestocks,Ok-Buy-9777,Depends on ur diversification also tbf,1,1718122636.0,Depends on ur diversification also tbf,0.0,6,6,Neutral
l84fejl,1ddef8p,applestocks,blue_rythm,Apple to $202. It's crazy. People are saving even on groceries and I wonder if they upgrade their iPhone this year due to high inflation.,1,1718117215.0,Apple to $202. It's crazy. People are saving even on groceries and I wonder if they upgrade their iPhone this year due to high inflation.,0.0364963503649635,25,24,Negative
l84nwjl,1ddef8p,applestocks,AdApprehensive8702,Wtf just happened? I was so disappointed yesterday that the stock moves lower..why is it jumping today? Someone explain pls,1,1718120111.0,Wtf just happened? I was so disappointed yesterday that the stock moves lower..why is it jumping today? Someone explain pls,0.032520325203252,20,20,Negative
l84vi50,1ddef8p,applestocks,Individual_Ad3239,wait for fed tmrw.. but people will always spend.. plus bnpl is an attractive offer to some these days,1,1718122634.0,wait for fed tmrw.. but people will always spend.. plus bnpl is an attractive offer to some these days,0.0392156862745098,19,19,Positive
l84nz2w,1ddef8p,applestocks,Happy-Conclusion7710,I TOLD YOU.....,1,1718120135.0,I TOLD YOU.....,0.3333333333333333,3,3,Neutral
l85cj2w,1ddef8p,applestocks,AdApprehensive8702,"Any reasons for that post-euphoria?😂
I‘m longterm invested with a big stack, so everything is fine - i‘m just wondering about that big ass move out of nowhere😄",1,1718128249.0,"Any reasons for that post-euphoria?😂
I‘m longterm invested with a big stack, so everything is fine - i‘m just wondering about that big ass move out of nowhere😄",0.050314465408805,28,26,Positive
l6xrmis,1d78p1i,applestocks,AngAntRy,Buy more. Hold,5,1717434876.0,Buy more. Hold,0.0714285714285714,3,3,Neutral
l6xvvw4,1d78p1i,applestocks,VonGeisler,"It’s not at its ATH yet, and Apple hasn’t even gotten into the AI era yet",5,1717436304.0,"It’s not at its ATH yet, and Apple hasn’t even gotten into the AI era yet",0.0410958904109589,16,16,Neutral
l6xro5w,1d78p1i,applestocks,AngAntRy,Then buy again when it dips. And again then repeat.,2,1717434891.0,Then buy again when it dips. And again then repeat.,0.0392156862745098,10,9,Neutral
l6xy1rw,1d78p1i,applestocks,keepBuyingApes,Only thing i’ll ever agree with Gene munster is over next 2 years apple will outperform Nvidia,2,1717437023.0,Only thing i’ll ever agree with Gene munster is over next 2 years apple will outperform Nvidia,0.0106382978723404,17,17,Positive
l78x0gr,1d78p1i,applestocks,GovernmentLittle5869,"Artificial Intelligence is a big cake with a share of Apple, don't quit before you eat the cake",1,1717608503.0,"Artificial Intelligence is a big cake with a share of Apple, don't quit before you eat the cake",0.0210526315789473,18,16,Positive
l7miwbm,1d78p1i,applestocks,Billgates420420,"Do not sell in my oppinion, will see a new 52 week high soon followed by more increases tech ai is going to be hot for a while and I have a feeling apples announcement might be pretty positive in that direction",1,1717815265.0,"Do not sell in my oppinion, will see a new 52 week high soon followed by more increases tech ai is going to be hot for a while and I have a feeling apples announcement might be pretty positive in that direction",0.0047619047619047,42,38,Positive
l84b8gm,1d78p1i,applestocks,averagestockinvestor,Still holding - Currently trading at 199.60$,1,1718115747.0,Still holding - Currently trading at 199.60$,0.0681818181818181,7,7,Neutral
lccw658,1d78p1i,applestocks,averagestockinvestor,"Update: $APPL it's trading at 228$/share - +35% in the past 3 months.

Still holding?",1,1720536368.0,"Update: $APPL it's trading at 228$/share - +35% in the past 3 months.

Still holding?",0.1176470588235294,15,15,Neutral
l6zjt0c,1d78p1i,applestocks,Local-Philosophy629,Will it dip soon ?,0,1717457088.0,Will it dip soon ?,0.0555555555555555,5,5,Neutral
l5qzdbg,1d1215b,applestocks,11th_Retriever,What appx return can I get?,2,1716734043.0,What appx return can I get?,0.037037037037037,6,6,Neutral
l4ykrmc,1cwql85,applestocks,diecorporations,$200 just around the corner.,3,1716254962.0,$200 just around the corner.,0.0714285714285714,5,5,Neutral
l4z3epp,1cwql85,applestocks,Imcertainofit,Apple is for the long haul not to trade that is my opinion.,2,1716263356.0,Apple is for the long haul not to trade that is my opinion.,0.0169491525423728,13,12,Neutral
l6coh11,1cwql85,applestocks,LegolasPR_19,Buy buy buy!!!,2,1717089855.0,Buy buy buy!!!,0.2142857142857142,3,3,Neutral
l12wf1l,1cbfavh,applestocks,Crowdfunder101,"Who is 11 The State? Can we only claim through them, or can we do it independently somehow?

Is it restricted to US residents?",1,1713982383.0,"Who is 11 The State? Can we only claim through them, or can we do it independently somehow?

Is it restricted to US residents?",0.0317460317460317,24,22,Negative
