comment_id,post_id,subreddit,comment_author,comment_body,comment_score,comment_created_utc,text,special_char_ratio,word_count,unique_word_count,sentiment
gsmmmic,mfbbsl,applestocks,Traderparkboy,"Sorry lol, people are really sleeping on this company right now, post split Tesla took off and Apple did a little dance between 120-140, seeing as they are now going to be a car manufacturer I would put them at 250- but with all the side show stuff going on I see it spinning tires for a while, the whole pandemic has the market upside down, I’m flabbergasted that Apple announces they will produce cars and stock bumps 5 percent, CCIV had whispers of a merger and the stock tripled before any ink dried on paper. So my original price target of 124 bucks is still in play lol.",3,1616971885.0,"Sorry lol, people are really sleeping on this company right now, post split Tesla took off and Apple did a little dance between 120-140, seeing as they are now going to be a car manufacturer I would put them at 250- but with all the side show stuff going on I see it spinning tires for a while, the whole pandemic has the market upside down, I’m flabbergasted that Apple announces they will produce cars and stock bumps 5 percent, CCIV had whispers of a merger and the stock tripled before any ink dried on paper. So my original price target of 124 bucks is still in play lol.",0.0190972222222222,109,92,Positive
gsmn6ab,mfbbsl,applestocks,IITEZiII,"Ya, I’m hearing all sorts of eoy predictions. Who tf knows at this point lol.",2,1616972179.0,"Ya, I’m hearing all sorts of eoy predictions. Who tf knows at this point lol.",0.0519480519480519,15,15,Positive
gsmniea,mfbbsl,applestocks,Traderparkboy,"If the Wsb/gme kids are right, the prices of these will continue to drop until the saga is over and shorts have covered, there are rumours of hedge funds getting the margin call Friday which is what caused the set up before closing bell, I am a noob but have been watching it closely, all we can do is thank them for the chance to buy Apple at a discount and watch the show. To me Apple is a500-700 dollar stock if Tesla is worth 700.",3,1616972359.0,"If the Wsb/gme kids are right, the prices of these will continue to drop until the saga is over and shorts have covered, there are rumours of hedge funds getting the margin call Friday which is what caused the set up before closing bell, I am a noob but have been watching it closely, all we can do is thank them for the chance to buy Apple at a discount and watch the show. To me Apple is a500-700 dollar stock if Tesla is worth 700.",0.0184331797235023,86,69,Positive
gs8qawb,mdd3en,applestocks,Traderparkboy,"It’s Citidel dumping stock so they can pay for GameStop. GameStop grew 60 percent today, Citidel is responsible for a massive massive amount of trading, people are also unloading apple to buy into GME, I hold both lol.",5,1616721574.0,"It’s Citidel dumping stock so they can pay for GameStop. GameStop grew 60 percent today, Citidel is responsible for a massive massive amount of trading, people are also unloading apple to buy into GME, I hold both lol.",0.0275229357798165,38,35,Positive
gs8s60h,mdd3en,applestocks,Alarmed-Box2843,I held both but then I got COVID so I let my trading partner work my account while I was sick. Pulled it together after a month and discovered he’d put more money into APPL and sold my GME.  Then APPL tanked and GME soared. Thanks bro...,3,1616722546.0,I held both but then I got COVID so I let my trading partner work my account while I was sick. Pulled it together after a month and discovered he’d put more money into APPL and sold my GME.  Then APPL tanked and GME soared. Thanks bro...,0.0295358649789029,47,39,Negative
gsaqn1p,mdd3en,applestocks,StatsMasterYT,Thanks for the info,1,1616770712.0,Thanks for the info,0.0,4,4,Positive
gs8uigd,mdd3en,applestocks,extol504,Still doesn’t explain the one second correction.,1,1616723769.0,Still doesn’t explain the one second correction.,0.0416666666666666,7,7,Neutral
gs8u81j,mdd3en,applestocks,Traderparkboy,"Sorry to hear you got covid by the way, sending my best and most positive vibes your way.❤️🍺",3,1616723618.0,"Sorry to hear you got covid by the way, sending my best and most positive vibes your way.❤️🍺",0.0543478260869565,18,18,Positive
gs8sizh,mdd3en,applestocks,Traderparkboy,"They are gonna GME again, this is a strategy to shake out the cheap inexpensive holds, he will tank it again ( in my newbie opinion) by friday it will either be at 40, or 400.",1,1616722734.0,"They are gonna GME again, this is a strategy to shake out the cheap inexpensive holds, he will tank it again ( in my newbie opinion) by friday it will either be at 40, or 400.",0.0342857142857142,36,34,Negative
gs8uykt,mdd3en,applestocks,Traderparkboy,"There have been whacky things going on, gme had a similar thing happen, I believe it was a million share order was bought and sold within milliseconds or something like that. Someone said it was just massive computer orders being filled be it sold or bought. Something to do with execution. But I am a total noob and am about 1 hour from bed. Do not listen to me.",1,1616724003.0,"There have been whacky things going on, gme had a similar thing happen, I believe it was a million share order was bought and sold within milliseconds or something like that. Someone said it was just massive computer orders being filled be it sold or bought. Something to do with execution. But I am a total noob and am about 1 hour from bed. Do not listen to me.",0.0192837465564738,69,57,Positive
gs8zjtv,mdd3en,applestocks,Alarmed-Box2843,Thanks. It really sucked. I still don’t feel well. DON’T GET IT!!,1,1616726480.0,Thanks. It really sucked. I still don’t feel well. DON’T GET IT!!,0.1076923076923077,12,12,Positive
gs8vz77,mdd3en,applestocks,extol504,"Ha I don’t doubt that automatic computers orders were at play here. Also if that were the case, think how much money was made if a million shares were immediately bought at $7 less and immediately back. 7 million dollars. In a flash.",1,1616724538.0,"Ha I don’t doubt that automatic computers orders were at play here. Also if that were the case, think how much money was made if a million shares were immediately bought at $7 less and immediately back. 7 million dollars. In a flash.",0.0300429184549356,43,35,Positive
gsarktu,mdd3en,applestocks,Traderparkboy,"I have to travel across Canada coast to coast next week, I am going from a province that gets about 5 cases a day, to a province that gets about 1000. Good times, stay safe and all the best!",1,1616771132.0,"I have to travel across Canada coast to coast next week, I am going from a province that gets about 5 cases a day, to a province that gets about 1000. Good times, stay safe and all the best!",0.0263157894736842,39,29,Positive
grpc1jx,m9xg9i,applestocks,InvestingGatorGirl,"Having been a very long term investor in Apple stock, I still continue to buy the dips on this Dynamic Growth and High Value company. 

This video pulls together the Strength of Apple’s push into autonomous car technology and reveals the strategic relationships and new patents that show a clear path to a fully autonomous Apple car in the near future.

How do I say Apple? 
Buy! Buy! Buy! 🦅🦅🦅",2,1616336969.0,"Having been a very long term investor in Apple stock, I still continue to buy the dips on this Dynamic Growth and High Value company. 

This video pulls together the Strength of Apple’s push into autonomous car technology and reveals the strategic relationships and new patents that show a clear path to a fully autonomous Apple car in the near future.

How do I say Apple? 
Buy! Buy! Buy! 🦅🦅🦅",0.0279898218829516,70,55,Positive
grfrol3,m871vt,applestocks,InvestingGatorGirl,"Investing in APPLE over the years has changed my life. It will continue to change yours. They have and continue to generate enormous mountains of cash, invest in themselves, their communities, and new business, and new frontiers are still coming. 

I’m forever buying the dips, like today, and will ever continue to do so. Apple Hawk!

🦅🦅🦅",1,1616120739.0,"Investing in APPLE over the years has changed my life. It will continue to change yours. They have and continue to generate enormous mountains of cash, invest in themselves, their communities, and new business, and new frontiers are still coming. 

I’m forever buying the dips, like today, and will ever continue to do so. Apple Hawk!

🦅🦅🦅",0.0442477876106194,57,46,Positive
grevtj6,m7vkbn,applestocks,InvestingGatorGirl,"Apple is my long, long term. Bought long ago and still buying. Stocks like this one have changed my life. I bought even more today. Buy the dips on APPLE, and you sh’ant be a sad investor. 

Seriously, they’re swimming in giant pools of cash. They are reinvesting in themselves and new companies. And when the car, or car connection technology starts, “Katie, bar the doors!”

If you want to know more, see the latest post on InvestHawks and you’ll never ask “if” about Apple again. 
💁🏻‍♀️",7,1616104553.0,"Apple is my long, long term. Bought long ago and still buying. Stocks like this one have changed my life. I bought even more today. Buy the dips on APPLE, and you sh’ant be a sad investor. 

Seriously, they’re swimming in giant pools of cash. They are reinvesting in themselves and new companies. And when the car, or car connection technology starts, “Katie, bar the doors!”

If you want to know more, see the latest post on InvestHawks and you’ll never ask “if” about Apple again. 
💁🏻‍♀️",0.0572597137014314,87,75,Positive
grdxz6n,m7vkbn,applestocks,Atxchillhaus123,"Same. But remember this is only 2 bad months . It ran until January 27th then has been a bloodbath. So febuary and March  just count that as two bad months I hope to be back at 140 in April. If we have 2-3 bad months out of 12 we won't look to bad as a long term investment. Lots of people were burnt by the CNBC and fake apple care rumors, then all the shorting happened. Like a well orchestrated pump and dump. Wish I had gotten out at 144 when I had the chance. Lots of people bought between 135-144 thinking this was safe . Feel your pain just keep holding.",5,1616089167.0,"Same. But remember this is only 2 bad months . It ran until January 27th then has been a bloodbath. So febuary and March  just count that as two bad months I hope to be back at 140 in April. If we have 2-3 bad months out of 12 we won't look to bad as a long term investment. Lots of people were burnt by the CNBC and fake apple care rumors, then all the shorting happened. Like a well orchestrated pump and dump. Wish I had gotten out at 144 when I had the chance. Lots of people bought between 135-144 thinking this was safe . Feel your pain just keep holding.",0.0249554367201426,113,86,Negative
grsfhbb,m7vkbn,applestocks,Hichek2,200 is way too high. More like 150 to 175 this year.,3,1616399437.0,200 is way too high. More like 150 to 175 this year.,0.0384615384615384,12,12,Positive
gt2m6p4,m7vkbn,applestocks,Real-Register-6085,I am holding 839 shares ....I really want into go to $150 this year at least  so I can sell most of it and load the boat after and still have cash left over to buy into other positions ... make sense guys?,2,1617309873.0,I am holding 839 shares ....I really want into go to $150 this year at least  so I can sell most of it and load the boat after and still have cash left over to buy into other positions ... make sense guys?,0.0439024390243902,43,39,Positive
grdy803,m7vkbn,applestocks,Rockyskyrocket,So at that point in January I was up so much that I was about to sell but I still think that it will go up.,4,1616089272.0,So at that point in January I was up so much that I was about to sell but I still think that it will go up.,0.0093457943925233,26,21,Neutral
grdykhk,m7vkbn,applestocks,Atxchillhaus123,Same ! Coulda walked away with a nice chunk of change . Had a sell order at 145ush but I think it started the decline just under that. Was expecting 150 and all these bullish analyst were calling for 155. Where is Wall street bets to help this shorted stock!,3,1616089420.0,Same ! Coulda walked away with a nice chunk of change . Had a sell order at 145ush but I think it started the decline just under that. Was expecting 150 and all these bullish analyst were calling for 155. Where is Wall street bets to help this shorted stock!,0.0193798449612403,50,49,Positive
gp86bv7,lu1u0q,applestocks,Unknown,Apple stock is a great long term hold. You know barring a nuclear war that it will provide some substantial gains.,1,1614546518.0,Apple stock is a great long term hold. You know barring a nuclear war that it will provide some substantial gains.,0.0175438596491228,21,20,Positive
gq4huv8,lu1u0q,applestocks,samsung031814,"Apple  is owned by mr buffet verify 120+billion wedbush analyst rates apple above 200. Verify
 Verify this too 

Don't worry coming up. They have deal to make phone in India cheaper better than China. They might take part india based gold and cripto hybrid to compete with Bitcoin. More realistic than Bitcoin that has no based for going up or down. India cripto is pegged to gold standard guaranty. China india japan working together on this project.  Working in 6g and eyeing electric car in India. Taka with tata motors and reliance.a india already created full ev solar car before elon musk. Look up the web. Apple going to 6g and india working in infancy of 8g. Meaning  people legally can work from home be holographic image live  transferred to any part of world holographically  instantaneously",1,1615143566.0,"Apple  is owned by mr buffet verify 120+billion wedbush analyst rates apple above 200. Verify
 Verify this too 

Don't worry coming up. They have deal to make phone in India cheaper better than China. They might take part india based gold and cripto hybrid to compete with Bitcoin. More realistic than Bitcoin that has no based for going up or down. India cripto is pegged to gold standard guaranty. China india japan working together on this project.  Working in 6g and eyeing electric car in India. Taka with tata motors and reliance.a india already created full ev solar car before elon musk. Look up the web. Apple going to 6g and india working in infancy of 8g. Meaning  people legally can work from home be holographic image live  transferred to any part of world holographically  instantaneously",0.0174563591022443,136,105,Positive
gq4kves,lu0mx8,applestocks,samsung031814,"Please buy apple for u  and me .apple is invested and even more investing in India. Elon musk headed to india to market his ev and recruiting engineer s from IIT.   Youngest popular population in India most populated Young people in India, democratic and liberal in the world. 

Fact 3million babies born in India every day and yes 1 million people also die everyday in the world overnight for reasons discovered after there demise. They go to sleep but never wake up alive.
Fact 1.5 billion indians in the world
Fact 100k engineer only in usa made a year. 2021 stats.
 China and india produce 800k engineer s a year.
Cream of crop engineer s go to in India  to india institute of technology called mit+ harvard+yale+ oxford of india. . If only 25percent super bright 😎 imagine next 25 years the exponential technology growth 💹 we are going to exploit by 2050. U hear gm wants all electric by 2035 . Sorry it's in by 2030. Way faster than I expect. Gm is headed for gold apple is gold  go to india.

Apple  is owned by mr buffet verify 120+billion wedbush analyst rates apple above 200. Verify
 Verify this too 

Don't worry coming up. They have deal to make phone in India cheaper better than China. They might take part india based gold and cripto hybrid to compete with Bitcoin. More realistic than Bitcoin that has no based for going up or down. India cripto is pegged to gold standard guaranty. China india japan working together on this project.  Working in 6g and eyeing electric car in India. Taka with tata motors and reliance.a india already created full ev solar car before elon musk. Look up the web. Apple going to 6g and india working in infancy of 8g. Meaning  people legally can work from home be holographic image live  transferred to any part of world holographically  instantaneously",1,1615144807.0,"Please buy apple for u  and me .apple is invested and even more investing in India. Elon musk headed to india to market his ev and recruiting engineer s from IIT.   Youngest popular population in India most populated Young people in India, democratic and liberal in the world. 

Fact 3million babies born in India every day and yes 1 million people also die everyday in the world overnight for reasons discovered after there demise. They go to sleep but never wake up alive.
Fact 1.5 billion indians in the world
Fact 100k engineer only in usa made a year. 2021 stats.
 China and india produce 800k engineer s a year.
Cream of crop engineer s go to in India  to india institute of technology called mit+ harvard+yale+ oxford of india. . If only 25percent super bright 😎 imagine next 25 years the exponential technology growth 💹 we are going to exploit by 2050. U hear gm wants all electric by 2035 . Sorry it's in by 2030. Way faster than I expect. Gm is headed for gold apple is gold  go to india.

Apple  is owned by mr buffet verify 120+billion wedbush analyst rates apple above 200. Verify
 Verify this too 

Don't worry coming up. They have deal to make phone in India cheaper better than China. They might take part india based gold and cripto hybrid to compete with Bitcoin. More realistic than Bitcoin that has no based for going up or down. India cripto is pegged to gold standard guaranty. China india japan working together on this project.  Working in 6g and eyeing electric car in India. Taka with tata motors and reliance.a india already created full ev solar car before elon musk. Look up the web. Apple going to 6g and india working in infancy of 8g. Meaning  people legally can work from home be holographic image live  transferred to any part of world holographically  instantaneously",0.0210876803551609,319,210,Positive
gos2mbp,lsm0uy,applestocks,Unknown,This is an older screen shot apple has fallen a lot since then but I believe it will bounce back!!,0,1614303004.0,This is an older screen shot apple has fallen a lot since then but I believe it will bounce back!!,0.0204081632653061,20,20,Negative
gq4moyu,lsm0uy,applestocks,samsung031814,"🍎 apple going to 200+

When was the first time I heard the word android. In 2000s. Sorry u are 15 plus years behind. It's was in 70s. And first for people general population in in 80 s. Look small wonder show on tube 🙂 u will hear android. There.

 Yes more to come.

Please buy apple for u  and me .apple is invested and even more investing in India. Elon musk headed to india to market his ev and recruiting engineer s from IIT.   Youngest popular population in India most populated Young people in India, democratic and liberal in the world. 

Fact 3million babies born in India every day and yes 1 million people also die everyday in the world overnight for reasons discovered after there demise. They go to sleep but never wake up alive.
Fact 1.5 billion indians in the world
Fact 100k engineer only in usa made a year. 2021 stats.
 China and india produce 800k engineer s a year.
Cream of crop engineer s go to in India  to india institute of technology called mit+ harvard+yale+ oxford of india. . If only 25percent super bright 😎 imagine next 25 years the exponential technology growth 💹 we are going to exploit by 2050. U hear gm wants all electric by 2035 . Sorry it's in by 2030. Way faster than I expect. Gm is headed for gold apple is gold  go to india.

Apple  is owned by mr buffet verify 120+billion wedbush analyst rates apple above 200. Verify
 Verify this too 

Don't worry coming up. They have deal to make phone in India cheaper better than China. They might take part india based gold and cripto hybrid to compete with Bitcoin. More realistic than Bitcoin that has no based for going up or down. India cripto is pegged to gold standard guaranty. China india japan working together on this project.  Working in 6g and eyeing electric car in India. Taka with tata motors and reliance.a india already created full ev solar car before elon musk. Look up the web. Apple going to 6g and india working in infancy of 8g. Meaning  people legally can work from home be holographic image live  transferred to any part of world holographically  instantaneously",1,1615145564.0,"🍎 apple going to 200+

When was the first time I heard the word android. In 2000s. Sorry u are 15 plus years behind. It's was in 70s. And first for people general population in in 80 s. Look small wonder show on tube 🙂 u will hear android. There.

 Yes more to come.

Please buy apple for u  and me .apple is invested and even more investing in India. Elon musk headed to india to market his ev and recruiting engineer s from IIT.   Youngest popular population in India most populated Young people in India, democratic and liberal in the world. 

Fact 3million babies born in India every day and yes 1 million people also die everyday in the world overnight for reasons discovered after there demise. They go to sleep but never wake up alive.
Fact 1.5 billion indians in the world
Fact 100k engineer only in usa made a year. 2021 stats.
 China and india produce 800k engineer s a year.
Cream of crop engineer s go to in India  to india institute of technology called mit+ harvard+yale+ oxford of india. . If only 25percent super bright 😎 imagine next 25 years the exponential technology growth 💹 we are going to exploit by 2050. U hear gm wants all electric by 2035 . Sorry it's in by 2030. Way faster than I expect. Gm is headed for gold apple is gold  go to india.

Apple  is owned by mr buffet verify 120+billion wedbush analyst rates apple above 200. Verify
 Verify this too 

Don't worry coming up. They have deal to make phone in India cheaper better than China. They might take part india based gold and cripto hybrid to compete with Bitcoin. More realistic than Bitcoin that has no based for going up or down. India cripto is pegged to gold standard guaranty. China india japan working together on this project.  Working in 6g and eyeing electric car in India. Taka with tata motors and reliance.a india already created full ev solar car before elon musk. Look up the web. Apple going to 6g and india working in infancy of 8g. Meaning  people legally can work from home be holographic image live  transferred to any part of world holographically  instantaneously",0.0241545893719806,373,239,Positive
gorzgv1,lsht78,applestocks,SeriousCriticism3048,I’m in.. apple to the moon!!!,3,1614301424.0,I’m in.. apple to the moon!!!,0.2068965517241379,6,6,Neutral
gorkt18,lsht78,applestocks,Infamous-Breath-5792,Looks highly optimistic but i hope man!,2,1614294229.0,Looks highly optimistic but i hope man!,0.0256410256410256,7,7,Positive
gosbau1,lsht78,applestocks,Zealousideal-Gain196,"Apple to the moon📈, let’s take it, it’s badly beaten",2,1614307439.0,"Apple to the moon📈, let’s take it, it’s badly beaten",0.0961538461538461,10,10,Negative
gosmn4d,lsht78,applestocks,copomec1,Should be going to the moon they're manipulating it make it skyrocket!,1,1614313625.0,Should be going to the moon they're manipulating it make it skyrocket!,0.0285714285714285,12,11,Negative
goyhfag,lsht78,applestocks,PickyRickie,Hope you sold those contracts,1,1614409944.0,Hope you sold those contracts,0.0,5,5,Positive
gorzluw,lsht78,applestocks,Unknown,Spread the word let’s bring the giant back on its feet,2,1614301495.0,Spread the word let’s bring the giant back on its feet,0.0185185185185185,11,10,Neutral
gosgzau,lsht78,applestocks,Unknown,Right there taking hits because of the tech sell off but it deserves better!,1,1614310400.0,Right there taking hits because of the tech sell off but it deserves better!,0.0131578947368421,14,14,Positive
gos1a91,lsht78,applestocks,SeriousCriticism3048,Let’s do it..,2,1614302334.0,Let’s do it..,0.2307692307692307,3,3,Neutral
gosq2gd,lsht78,applestocks,Zealousideal-Gain196,I bought 50 contracts of $145 call on their earning report day since January 27th. Contracts expire March 19th. Am currently down over $37k.  Current price is $.30 while my price is at $7.75. Been wishing that some good news gets it moving up again so I can get half or two third of my investment back.😭😭😭,1,1614315745.0,I bought 50 contracts of $145 call on their earning report day since January 27th. Contracts expire March 19th. Am currently down over $37k.  Current price is $.30 while my price is at $7.75. Been wishing that some good news gets it moving up again so I can get half or two third of my investment back.😭😭😭,0.0459016393442622,57,52,Negative
gorn85c,lshhcg,applestocks,Fabulous-Monitor9870,I think appl to the 135 soon after gamestock trader jump,3,1614295390.0,I think appl to the 135 soon after gamestock trader jump,0.0,11,11,Neutral
gorxmjx,lshhcg,applestocks,SeriousCriticism3048,"It will go back, hang tight!!! I bought more, deep=buy...",2,1614300515.0,"It will go back, hang tight!!! I bought more, deep=buy...",0.1578947368421052,10,10,Neutral
