comment_id,post_id,subreddit,comment_author,comment_body,comment_score,comment_created_utc,text,special_char_ratio,word_count,unique_word_count,sentiment
mf4uibr,1iy04ol,applestocks,AngAntRy,"Apple will be first stock to 4 Trillion market cap, 5 Trillion and so on!",2,1740688980.0,"Apple will be first stock to 4 Trillion market cap, 5 Trillion and so on!",0.0273972602739726,15,14,Neutral
mf6cydi,1iy04ol,applestocks,Opposite_Steak_4032,What do you think Would Fiscal years 1990-1995  Shareholders booklet for Fiscal Year End Reports be worth?   Multi colored logo back then,2,1740705993.0,What do you think Would Fiscal years 1990-1995  Shareholders booklet for Fiscal Year End Reports be worth?   Multi colored logo back then,0.0145985401459854,22,21,Positive
merzf25,1iy04ol,applestocks,hartwerger,Think different. They’ve been doing ‘DEI’ since the dawn of time.,1,1740520200.0,Think different. They’ve been doing ‘DEI’ since the dawn of time.,0.0769230769230769,11,11,Neutral
mdywjhb,1iunfst,applestocks,Plobiscushibcus,"Thank you for posting, interesting summary.",1,1740135705.0,"Thank you for posting, interesting summary.",0.0465116279069767,6,6,Positive
medqh1d,1iu3lir,applestocks,afinitie,$1.33? The fuck am I gonna do with $1.33? Ridiculous.,1,1740335125.0,$1.33? The fuck am I gonna do with $1.33? Ridiculous.,0.1320754716981132,10,9,Negative
mej1rk1,1iu3lir,applestocks,thesatisfiedplethora,It depends on how many shares did you own back then.. This is the amount per share.,1,1740410160.0,It depends on how many shares did you own back then.. This is the amount per share.,0.036144578313253,17,17,Positive
mc7knsk,1in342f,applestocks,Formal_Substance6437,"https://stocks.apple.com/AoZmQdLWKSK2eQjhOshSw7A

This maybe",2,1739292962.0,"https://stocks.apple.com/AoZmQdLWKSK2eQjhOshSw7A

This maybe",0.1,3,3,Neutral
mc7liws,1in342f,applestocks,Investingforlife,"AAPL working with Alibaba to incorporate AI.
Also new beats debut.",2,1739293204.0,"AAPL working with Alibaba to incorporate AI.
Also new beats debut.",0.0303030303030303,11,11,Neutral
mc7kug1,1in342f,applestocks,Sfareco,Good pickup. Thanks.,1,1739293014.0,Good pickup. Thanks.,0.1,3,3,Positive
ma9vw7a,1iep4pt,applestocks,Dry-Way-5688,"Would not count AAPL out yet. Once they figure out AI or other innovations, they will be back again.",3,1738361538.0,"Would not count AAPL out yet. Once they figure out AI or other innovations, they will be back again.",0.03,19,17,Neutral
madqowj,1iep4pt,applestocks,TAKANOGENJI,"If you lived there once and know how cn ppl crave iphones, you’ll know this sale shrinking is BS and Cook would make sure his fair share of China is intact. These recently months their products are in a constant out of stock in CN thanks to the stimulus subsidies.",3,1738420887.0,"If you lived there once and know how cn ppl crave iphones, you’ll know this sale shrinking is BS and Cook would make sure his fair share of China is intact. These recently months their products are in a constant out of stock in CN thanks to the stimulus subsidies.",0.0151515151515151,50,45,Positive
mab5r2q,1iep4pt,applestocks,messengers1,"In China, you cannot go on strike and complain but in other countries, workers can. In Russia, it is not a place for business. China controls currency and policy.

I have been holding 100 shares @119.5 since Oct, 2020. It was not the cheapest. I know that the share price went under 100 after I got the shares. It doesn't affect me because my profit return is more than 100%.",2,1738376514.0,"In China, you cannot go on strike and complain but in other countries, workers can. In Russia, it is not a place for business. China controls currency and policy.

I have been holding 100 shares @119.5 since Oct, 2020. It was not the cheapest. I know that the share price went under 100 after I got the shares. It doesn't affect me because my profit return is more than 100%.",0.04,70,60,Positive
ma9xvcf,1iep4pt,applestocks,DekeJeffery,Exactly.  I feel like I’ve been hearing “Apple is done” for 15 years now.,4,1738362124.0,Exactly.  I feel like I’ve been hearing “Apple is done” for 15 years now.,0.0684931506849315,14,14,Positive
mayldz3,1iep4pt,applestocks,Financial-Stick-8500,Totally agree! And I think most of us are expecting that moment!,1,1738692238.0,Totally agree! And I think most of us are expecting that moment!,0.03125,12,12,Positive
ma5n50f,1ie2sss,applestocks,OnizukaEikichi666,"I have 30% portfolio on apple stock, still holding.",5,1738305773.0,"I have 30% portfolio on apple stock, still holding.",0.0588235294117647,9,9,Neutral
ma68lca,1ie2sss,applestocks,ifit21,"No one can say with any certainty because it’s not that easy.  Buy what you believe in not what others are saying on the new or Reddit. As I’ve mentioned many times I bought Apple when I was just a little older than you.  When the headlines were “The Apple is Rotten” in 1999. My cost basis is $.33 and I’m up 81,000% and still own it.  Sooooo many people, media, analyst and advisors told me to sell over the years I lost track.",4,1738318696.0,"No one can say with any certainty because it’s not that easy.  Buy what you believe in not what others are saying on the new or Reddit. As I’ve mentioned many times I bought Apple when I was just a little older than you.  When the headlines were “The Apple is Rotten” in 1999. My cost basis is $.33 and I’m up 81,000% and still own it.  Sooooo many people, media, analyst and advisors told me to sell over the years I lost track.",0.0396270396270396,84,72,Negative
ma46cgo,1ie2sss,applestocks,InternationalMud9785,"Sorry if it’s a stupid question for some people, just want to learn how to do this right!",1,1738285327.0,"Sorry if it’s a stupid question for some people, just want to learn how to do this right!",0.0337078651685393,18,17,Negative
ma60726,1ie2sss,applestocks,Support_silver_,I have held apple for the past years but am a bit hesitant now. Their integration of AI is not yet where it needs to be which is logical since nobody has figured it out yet but because of this I think they are overvalued today. Once they figure the implementation out it will be a different story.,1,1738313412.0,I have held apple for the past years but am a bit hesitant now. Their integration of AI is not yet where it needs to be which is logical since nobody has figured it out yet but because of this I think they are overvalued today. Once they figure the implementation out it will be a different story.,0.0101010101010101,58,46,Negative
ma78goy,1ie2sss,applestocks,Content-Anybody9870,Awesome job on investing at your age. I’ve held apply for 7yrs and still old it.,1,1738334286.0,Awesome job on investing at your age. I’ve held apply for 7yrs and still old it.,0.0375,16,16,Positive
mb1e59k,1ie2sss,applestocks,jrock_697,Apple prints. They still have the best hardware. Consumer AI will go through Apple at least 30%,1,1738722849.0,Apple prints. They still have the best hardware. Consumer AI will go through Apple at least 30%,0.031578947368421,17,16,Positive
mabrgqb,1ie2sss,applestocks,AngAntRy,Same I’m closer to 40% plan on holding for a long time!,2,1738384816.0,Same I’m closer to 40% plan on holding for a long time!,0.0545454545454545,12,12,Neutral
ma69aat,1ie2sss,applestocks,raphaelwien,That’s amazing congrats,1,1738319113.0,That’s amazing congrats,0.0434782608695652,3,3,Positive
ma48ppi,1ie2sss,applestocks,HellveticaNeue,"It’s not a stupid question.

And congratulations for investing at age 18. I didn’t start investing til much later in life so you’re doing fantastic.

To answer your question, no one knows. All we know is past history, which doesn’t dictate the future, but can be useful data.

My opinion, is that Apple stock might be a bit rocky in the near term. Primarily because Trump is so unpredictable. He recently called for 100% tariffs on TSMC chips. You just never know what he will do and the market can over react.

That said, in the long run, my opinion (again) is that Apple will continue to be one of the most valuable companies in the world. They are extremely well run. They have a differentiated product, that acts as their moat. And they have an enormous fan base.

I think 243 might be a little high in the short term, but I’d actually buy more the next time it drops to down cost average.

Good luck, and keep asking questions. Just remember that no one knows what will happen. If they say they do, they’re lying.",7,1738286107.0,"It’s not a stupid question.

And congratulations for investing at age 18. I didn’t start investing til much later in life so you’re doing fantastic.

To answer your question, no one knows. All we know is past history, which doesn’t dictate the future, but can be useful data.

My opinion, is that Apple stock might be a bit rocky in the near term. Primarily because Trump is so unpredictable. He recently called for 100% tariffs on TSMC chips. You just never know what he will do and the market can over react.

That said, in the long run, my opinion (again) is that Apple will continue to be one of the most valuable companies in the world. They are extremely well run. They have a differentiated product, that acts as their moat. And they have an enormous fan base.

I think 243 might be a little high in the short term, but I’d actually buy more the next time it drops to down cost average.

Good luck, and keep asking questions. Just remember that no one knows what will happen. If they say they do, they’re lying.",0.0353634577603143,187,142,Positive
ma48kyz,1ie2sss,applestocks,299421,"It's hard to decide. I will be worried to hold apple for so long. I think 5 years will be max. Sometime, things changes a bit quick.. (they are kind of at their max potential, they are just selling at rate higher than inflation to grow to their company, any change to market share is detrimental)

I don't want to pin point what will decrease it, but I guess we will know soon by 2030.",0,1738286064.0,"It's hard to decide. I will be worried to hold apple for so long. I think 5 years will be max. Sometime, things changes a bit quick.. (they are kind of at their max potential, they are just selling at rate higher than inflation to grow to their company, any change to market share is detrimental)

I don't want to pin point what will decrease it, but I guess we will know soon by 2030.",0.0363636363636363,75,60,Negative
ma43kfx,1ie11h2,applestocks,ifit21,Conspiracy theories are fun but if you listen to the call you would have learned that 2025 guidance was higher than expected hence the pop.,2,1738284425.0,Conspiracy theories are fun but if you listen to the call you would have learned that 2025 guidance was higher than expected hence the pop.,0.0071942446043165,25,23,Neutral
ma4mthn,1ie11h2,applestocks,johnhuey,Huge share buy back announced,2,1738290818.0,Huge share buy back announced,0.0,5,5,Positive
ma4sih1,1ie11h2,applestocks,zmmather,AAPL is cheap. BUY!!!,2,1738292787.0,AAPL is cheap. BUY!!!,0.1904761904761904,4,4,Neutral
ma5tz0q,1ie11h2,applestocks,Smartorial,"During an after market earnings report, the entire report is actually sent 30 mins ahead to financial analysts so they can digest the info and ask specific questions about it. 

That may be why you’re seeing after hours action in contrast with the day’s trading. 

Example

4pm markets close. 
4:30 earnings report is given to analysts and firms. (People with access trade after hours. Still risky) 
5PM call starts and specific questions are asked. (And depending on what the company’s says, it can swing the stock the other way after hours. I have seen that. Buybacks, huge contracts, forecasts etc)",2,1738309635.0,"During an after market earnings report, the entire report is actually sent 30 mins ahead to financial analysts so they can digest the info and ask specific questions about it. 

That may be why you’re seeing after hours action in contrast with the day’s trading. 

Example

4pm markets close. 
4:30 earnings report is given to analysts and firms. (People with access trade after hours. Still risky) 
5PM call starts and specific questions are asked. (And depending on what the company’s says, it can swing the stock the other way after hours. I have seen that. Buybacks, huge contracts, forecasts etc)",0.0332778702163061,100,80,Positive
ma3zhrp,1ie11h2,applestocks,HellveticaNeue,Guess you bet wrong?,1,1738283109.0,Guess you bet wrong?,0.05,4,4,Negative
ma62qyz,1ie11h2,applestocks,AnyAlps7650,Apple stock always struggle at earnings. come to be used to seeing it dip and buy more. i’m with CRAMER it’s a hold/buy,1,1738315030.0,Apple stock always struggle at earnings. come to be used to seeing it dip and buy more. i’m with CRAMER it’s a hold/buy,0.042016806722689,23,22,Negative
ma4n8h4,1ie11h2,applestocks,Advanced_Usual_8662,Go figure 🤦‍♂️,1,1738290959.0,Go figure 🤦‍♂️,0.2857142857142857,3,3,Neutral
ma8lrat,1ie11h2,applestocks,Advanced_Usual_8662,"It is now! Thanks for this obnoxious post Z, it triggered me and gave me the drive to turn a 1300 loss into a $2000 gain",1,1738348416.0,"It is now! Thanks for this obnoxious post Z, it triggered me and gave me the drive to turn a 1300 loss into a $2000 gain",0.025,26,24,Positive
ma40dt4,1ie11h2,applestocks,Advanced_Usual_8662,"I guess big money decides who is right or wrong?Time will tell… Just thought it was smart money running up the value of options just before close..? And the stock goes down after market , I mean tanks, supporting smart money theory but then instantly shoots to the moon?",1,1738283399.0,"I guess big money decides who is right or wrong?Time will tell… Just thought it was smart money running up the value of options just before close..? And the stock goes down after market , I mean tanks, supporting smart money theory but then instantly shoots to the moon?",0.0296296296296296,49,43,Positive
ma8m305,1ie11h2,applestocks,Advanced_Usual_8662,"Yeah it worked out though. I kept betting and my
 -$1300 this morning turned into +$2000 not 20 min ago",1,1738348507.0,"Yeah it worked out though. I kept betting and my
 -$1300 this morning turned into +$2000 not 20 min ago",0.0485436893203883,20,20,Positive
ma8pnkj,1ie11h2,applestocks,zmmather,"Well. If you are chasing a $1,300 loss. Then you should not be in AAPL. AAPL is a long position stock. If you want to chase losses, try Draft Kings or Fanduel. SMH",1,1738349502.0,"Well. If you are chasing a $1,300 loss. Then you should not be in AAPL. AAPL is a long position stock. If you want to chase losses, try Draft Kings or Fanduel. SMH",0.0490797546012269,33,29,Negative
ma4aaoq,1ie11h2,applestocks,HellveticaNeue,"I’m sorry if you lost money.

My comment was focused on the word bet and the gambling aspect of playing options. I just hold.",2,1738286626.0,"I’m sorry if you lost money.

My comment was focused on the word bet and the gambling aspect of playing options. I just hold.",0.032,24,23,Positive
ma9ttuc,1ie11h2,applestocks,Active_Reason_2852,Genius move... trade draft kings stock🤔,1,1738360930.0,Genius move... trade draft kings stock🤔,0.1025641025641025,6,6,Neutral
ma4brr9,1ie11h2,applestocks,Advanced_Usual_8662,Thanks for your concern. And I appreciate you holding onto a cornerstone of the stock market 🫡,2,1738287115.0,Thanks for your concern. And I appreciate you holding onto a cornerstone of the stock market 🫡,0.0212765957446808,17,17,Positive
mabcevq,1ie11h2,applestocks,zmmather,You’re confused. I meant place bets on sports. SMH,1,1738378886.0,You’re confused. I meant place bets on sports. SMH,0.06,9,9,Negative
mabjrge,1ie11h2,applestocks,zmmather,"If you want help with AAPL, I willing to help.

I’ve been long in AAPL since early 2000s. The only trades I’ve made since then are buying when I believe the stock is selling at a discount.

The biggest mistake you can make with a stock such as APPL is panic on the downturns. Really that goes for the market in general.

Right now I hold over 2,700 shares of APPL. Market value is $641,920. Total Gain/Loss is +$340,000. Cost per share is $111.00. The total gain is currently 112.61%.

To my original post, I think AAPL is a buy right now. I’m not saying it won’t go down from here. I do believe it is a good buy for a long position. Plus it pays a dividend.

Hope this helps.",1,1738381642.0,"If you want help with AAPL, I willing to help.

I’ve been long in AAPL since early 2000s. The only trades I’ve made since then are buying when I believe the stock is selling at a discount.

The biggest mistake you can make with a stock such as APPL is panic on the downturns. Really that goes for the market in general.

Right now I hold over 2,700 shares of APPL. Market value is $641,920. Total Gain/Loss is +$340,000. Cost per share is $111.00. The total gain is currently 112.61%.

To my original post, I think AAPL is a buy right now. I’m not saying it won’t go down from here. I do believe it is a good buy for a long position. Plus it pays a dividend.

Hope this helps.",0.0473372781065088,131,98,Positive
mabdgjv,1ie11h2,applestocks,Active_Reason_2852,No you are bud,1,1738379267.0,No you are bud,0.0,4,4,Negative
mabdrgg,1ie11h2,applestocks,zmmather,Clever. You are right. Good luck.,1,1738379379.0,Clever. You are right. Good luck.,0.0909090909090909,6,6,Positive
mcl4y5q,1ie11h2,applestocks,Active_Reason_2852,You were the godsend sign I needed,1,1739469406.0,You were the godsend sign I needed,0.0,7,7,Positive
ma651dz,1idxqdp,applestocks,Tommy28562856,In the Apple Stock app :) but thanks!,1,1738316476.0,In the Apple Stock app :) but thanks!,0.081081081081081,8,8,Positive
m9ywsl3,1idefwm,applestocks,messengers1,"I voted against those who are over 70 as board members. We need some younger and more ambitious members on board.

I voted for those that were recommended to go against.",1,1738218250.0,"I voted against those who are over 70 as board members. We need some younger and more ambitious members on board.

I voted for those that were recommended to go against.",0.0177514792899408,31,28,Positive
ma12nko,1idefwm,applestocks,Next_Tourist4055,"I took a quick glance at this.  Some of those ballot measures the Board is recommending a ""no"" vote was likely proposed by activist investors.  These can be investors who have an agenda other than what may be in the best interest of a company looking to make money for its shareholders. For example

\- ""Report on Costs and Benefits of Child S-- Abuse Material, etc"" -  this is likely an expensive program that will in no way benefit shareholders.  It might not even address what it claims, but there is no way of knowing what the activists are trying to do here.

\- ""A shareholder's proposal entitled ""Request to Cease DEI Efforts"" - sounds good, but again, it is being proposed by activists with an agenda. 

The Board is allowed to give its recommendations.  You may agree or disagree with some of these things proposed.  This is why you are being allowed to vote on it.  In fact, I could see myself voting ""for"" some of the proposals, if I were sure it was truly in the best interest of the Company as a whole.  I would probably need additional information, though.",1,1738253364.0,"I took a quick glance at this.  Some of those ballot measures the Board is recommending a ""no"" vote was likely proposed by activist investors.  These can be investors who have an agenda other than what may be in the best interest of a company looking to make money for its shareholders. For example

\- ""Report on Costs and Benefits of Child S-- Abuse Material, etc"" -  this is likely an expensive program that will in no way benefit shareholders.  It might not even address what it claims, but there is no way of knowing what the activists are trying to do here.

\- ""A shareholder's proposal entitled ""Request to Cease DEI Efforts"" - sounds good, but again, it is being proposed by activists with an agenda. 

The Board is allowed to give its recommendations.  You may agree or disagree with some of these things proposed.  This is why you are being allowed to vote on it.  In fact, I could see myself voting ""for"" some of the proposals, if I were sure it was truly in the best interest of the Company as a whole.  I would probably need additional information, though.",0.0336448598130841,193,135,Positive
ma8si5w,1idefwm,applestocks,Unknown,Recommend you read the Details of each proposal. I found some of the titles misleading. The one on Charitable Giving for example seems targeted at beneficiaries like SPLC. ,1,1738350299.0,Recommend you read the Details of each proposal. I found some of the titles misleading. The one on Charitable Giving for example seems targeted at beneficiaries like SPLC. ,0.0174418604651162,28,26,Positive
m9yi8r6,1idefwm,applestocks,Accomplished_Ad3313,Because it can bring too many negative perceptions onto the business!,0,1738211685.0,Because it can bring too many negative perceptions onto the business!,0.0144927536231884,11,11,Negative
ma13d0f,1idefwm,applestocks,Next_Tourist4055,"Understand that most of these ballot measures will go nowhere. The only time they have a chance of passing is when a strong activist investor who has accumulated a substantial stake in the company gets behind them.  Most investors otherwise ignore ballots like this one, and the people who own a vast majority of the shares will be very hard to out-vote.",2,1738253565.0,"Understand that most of these ballot measures will go nowhere. The only time they have a chance of passing is when a strong activist investor who has accumulated a substantial stake in the company gets behind them.  Most investors otherwise ignore ballots like this one, and the people who own a vast majority of the shares will be very hard to out-vote.",0.0141242937853107,62,53,Positive
m9yim8s,1idefwm,applestocks,bridgehamton,But it’s a shareholder proposal that the board recommends to vote against…,0,1738211838.0,But it’s a shareholder proposal that the board recommends to vote against…,0.027027027027027,12,12,Positive
m9yircq,1idefwm,applestocks,Accomplished_Ad3313,I agree. It should be made. But of course the board will be against it because of my above comment - just my thoughts. I could be wrong.,0,1738211896.0,I agree. It should be made. But of course the board will be against it because of my above comment - just my thoughts. I could be wrong.,0.0367647058823529,28,23,Negative
m90pta0,1i9bord,applestocks,Ok-Bend8851,"Never bet against Apple, they call it the mini S&P for a reason.",13,1737768914.0,"Never bet against Apple, they call it the mini S&P for a reason.",0.046875,13,13,Neutral
m90urj3,1i9bord,applestocks,extol504,Well in 5 years the world population has grown by nearly 500 million people. They gonna need phones soon,9,1737770623.0,Well in 5 years the world population has grown by nearly 500 million people. They gonna need phones soon,0.0096153846153846,19,19,Positive
m90reg8,1i9bord,applestocks,Decent-Soup3551,Great company. Long term. IMHO Hold and buy more.,7,1737769459.0,Great company. Long term. IMHO Hold and buy more.,0.0612244897959183,9,9,Positive
m92kjfu,1i9bord,applestocks,ifit21,"It’s hard to ignore the media.  They make up stories based upon the stock movement that day. One day it’s a loser. The next a winner. I did my best to ignore the noise and have been rewarded with 81,000% gain since I bought it and still own.",9,1737801023.0,"It’s hard to ignore the media.  They make up stories based upon the stock movement that day. One day it’s a loser. The next a winner. I did my best to ignore the noise and have been rewarded with 81,000% gain since I bought it and still own.",0.0373443983402489,48,41,Positive
m94pcvf,1i9bord,applestocks,No-Wall-391,If you are following ups and downs of your portfolio on a weekly basis then maybe stick to ETFs.,6,1737829491.0,If you are following ups and downs of your portfolio on a weekly basis then maybe stick to ETFs.,0.0104166666666666,19,19,Neutral
m90uf96,1i9bord,applestocks,Affectionate-Use4801,I just put a lot of money in every stock that had its owner standing alongside Trump kissing his ass,3,1737770502.0,I just put a lot of money in every stock that had its owner standing alongside Trump kissing his ass,0.0,20,20,Positive
m91rjk6,1i9bord,applestocks,brit1973,"Four years is not a long term investor. Been holding and growing stake since 2009. I would keep a stake in an IRA stake and treat it as a wealth creator over decades. Yes, there are some other compelling opportunities out there, but hard to know how many companies will be creating wealth 20-30 years from now.",3,1737783758.0,"Four years is not a long term investor. Been holding and growing stake since 2009. I would keep a stake in an IRA stake and treat it as a wealth creator over decades. Yes, there are some other compelling opportunities out there, but hard to know how many companies will be creating wealth 20-30 years from now.",0.0225806451612903,57,50,Positive
m9110kf,1i9bord,applestocks,Available-Mine3845,Agree with you. Apple is a good stock. But there are way more better growth stocks out there.,2,1737772849.0,Agree with you. Apple is a good stock. But there are way more better growth stocks out there.,0.032258064516129,18,18,Positive
m9oc8dn,1i9bord,applestocks,Accomplished_Ad3313,Nah man! APPL is so ahead of 99% of companies just through valuation and what they’ve done. Why would you sell it! They have the financial means to go into ANY business industry. And have a FIRM grip over a huge chunk of the technology industry.,2,1738087832.0,Nah man! APPL is so ahead of 99% of companies just through valuation and what they’ve done. Why would you sell it! They have the financial means to go into ANY business industry. And have a FIRM grip over a huge chunk of the technology industry.,0.0285714285714285,46,40,Positive
