comment_id,post_id,subreddit,comment_author,comment_body,comment_score,comment_created_utc,text,special_char_ratio,word_count,unique_word_count,sentiment
k050ndz,16fyfap,applestocks,VonGeisler,"I’ve been a share holder for at least 20 years now, and I feel a lot of it’s movement is not tied in anyway to news. Apple is so larger that it is used as a hedge bank bet. When hedge funds need additional leverage they sell some of their apple position and when they need margin they put it back in. Often apple drops when other sectors are pumping. I feel this is almost all large stocks now where buying/selling pressure is completely unrelated to the stocks performance.",3,1694454284.0,"I’ve been a share holder for at least 20 years now, and I feel a lot of it’s movement is not tied in anyway to news. Apple is so larger that it is used as a hedge bank bet. When hedge funds need additional leverage they sell some of their apple position and when they need margin they put it back in. Often apple drops when other sectors are pumping. I feel this is almost all large stocks now where buying/selling pressure is completely unrelated to the stocks performance.",0.0189873417721519,89,70,Neutral
k4gmxkx,16fyfap,applestocks,allie_fun,"Just started investing in apple, plan to stick with them
for a while 🤞🏻",3,1697053457.0,"Just started investing in apple, plan to stick with them
for a while 🤞🏻",0.0422535211267605,14,14,Neutral
k04r540,16fyfap,applestocks,kru_pharaoh,Bought a 6 week option hoping it recovers,2,1694450884.0,Bought a 6 week option hoping it recovers,0.0,8,8,Positive
k0528n6,16fyfap,applestocks,kru_pharaoh,So you think the China news isn’t going to impact that much?,2,1694454846.0,So you think the China news isn’t going to impact that much?,0.0333333333333333,12,12,Neutral
k05zmir,16fyfap,applestocks,Imcertainofit,"I do agree when the majority of tech is doing well on any given day Apple seems to not do well and when they report great earnings their stock slumps. They dont get the huge bumps like NVDA or TSLA but I dont trust those companies, certainly not META. I look at volume too when things go south. Not sure how many individuals own Apple but I do know Warren Buffett loves the company. What you had to say is very interesting. My take is anyone who owns Apple is pretty darn smart in my book. 😁",1,1694466626.0,"I do agree when the majority of tech is doing well on any given day Apple seems to not do well and when they report great earnings their stock slumps. They dont get the huge bumps like NVDA or TSLA but I dont trust those companies, certainly not META. I look at volume too when things go south. Not sure how many individuals own Apple but I do know Warren Buffett loves the company. What you had to say is very interesting. My take is anyone who owns Apple is pretty darn smart in my book. 😁",0.0162932790224032,97,78,Positive
k4gz78j,16fyfap,applestocks,Imcertainofit,Stick with it. Apple is a long term stock not one to short or play the market with. It is a fabulous company. Like with any stock you have ups and downs. Especially with everything going on. Just read about it. Dan Ives with Wedbush is a great analyst,1,1697057831.0,Stick with it. Apple is a long term stock not one to short or play the market with. It is a fabulous company. Like with any stock you have ups and downs. Especially with everything going on. Just read about it. Dan Ives with Wedbush is a great analyst,0.0239043824701195,49,40,Positive
k04trgt,16fyfap,applestocks,Imcertainofit,Ive been a huge investor for years. I been through all the highs and lows and trust me it has been a rough ride. But apple is a great company. They have nearly $52 billion in cash; they are slowly moving manufacturing away from China into India which is going to be a whole new world for Apple. Im not a big options/shorting person I buy a company and stick with it. You really have to drown out all the naysayers and look into what the fundamentals of this company is all about. Keep the faith.,3,1694451828.0,Ive been a huge investor for years. I been through all the highs and lows and trust me it has been a rough ride. But apple is a great company. They have nearly $52 billion in cash; they are slowly moving manufacturing away from China into India which is going to be a whole new world for Apple. Im not a big options/shorting person I buy a company and stick with it. You really have to drown out all the naysayers and look into what the fundamentals of this company is all about. Keep the faith.,0.0202020202020202,96,73,Positive
k056nl9,16fyfap,applestocks,VonGeisler,I don’t think it’s currently what’s driving the price down. It’s not a China wide ban.,2,1694456433.0,I don’t think it’s currently what’s driving the price down. It’s not a China wide ban.,0.0697674418604651,16,16,Negative
k04u76t,16fyfap,applestocks,kru_pharaoh,Agreed man! I have apple stock in another portfolio and have had it through a couple splits already. I just play options in a different portfolio to try n make a killing. Also I placed a call option. Banking on it getting back to $187 by mid October. Hope that gives more insight,2,1694451987.0,Agreed man! I have apple stock in another portfolio and have had it through a couple splits already. I just play options in a different portfolio to try n make a killing. Also I placed a call option. Banking on it getting back to $187 by mid October. Hope that gives more insight,0.021505376344086,53,43,Negative
k056xtj,16fyfap,applestocks,kru_pharaoh,"Right, it’s only government, but you don’t think its a misdirected fear of a country wide ban?",2,1694456533.0,"Right, it’s only government, but you don’t think its a misdirected fear of a country wide ban?",0.0531914893617021,17,16,Negative
k04y8gq,16fyfap,applestocks,Imcertainofit,Im so happy to meet another Apple fan. I know it is hard. The drop the last several days was unexpected and in 2021. The analysts except for a few like Dan Ives constantly crap on it. Cramer loves it of course and the lady who was promoted at Morgan Stanley and there is some new guy I dont know his name but all the others just $hit on it. I just laugh.,1,1694453425.0,Im so happy to meet another Apple fan. I know it is hard. The drop the last several days was unexpected and in 2021. The analysts except for a few like Dan Ives constantly crap on it. Cramer loves it of course and the lady who was promoted at Morgan Stanley and there is some new guy I dont know his name but all the others just $hit on it. I just laugh.,0.019774011299435,73,59,Positive
k05cvxz,16fyfap,applestocks,VonGeisler,"The black market iPhone scene was huge before China started allowing the sale, so I don’t think it will have long term affect on numbers personally. But like I mentioned before I don’t think numbers matter for the price, apple is big enough to be a secure spot for market manipulation - same with the other FAANG stocks.",2,1694458638.0,"The black market iPhone scene was huge before China started allowing the sale, so I don’t think it will have long term affect on numbers personally. But like I mentioned before I don’t think numbers matter for the price, apple is big enough to be a secure spot for market manipulation - same with the other FAANG stocks.",0.021875,58,48,Positive
k04zsd6,16fyfap,applestocks,kru_pharaoh,Right and I don’t know why they do. I have been up consistently 37% on my apple holdings. And imma keep buying!,1,1694453977.0,Right and I don’t know why they do. I have been up consistently 37% on my apple holdings. And imma keep buying!,0.045045045045045,22,21,Neutral
k05d7h2,16fyfap,applestocks,kru_pharaoh,Gotcha man. Appreciate the insight.,2,1694458750.0,Gotcha man. Appreciate the insight.,0.0571428571428571,5,5,Positive
k04xb9r,15tw3ld,applestocks,Imcertainofit,"Apple is not known for it’s high dividends. It is a nice bonus for a technology stock to offer a dividend because stocks like Alphabet (Googl, AMZN, NVDA, TSLA etc. dont offer dividends) Apple also does buy backs. 😁",1,1694453099.0,"Apple is not known for it’s high dividends. It is a nice bonus for a technology stock to offer a dividend because stocks like Alphabet (Googl, AMZN, NVDA, TSLA etc. dont offer dividends) Apple also does buy backs. 😁",0.0465116279069767,39,33,Positive
iv5p32w,ymdl7x,applestocks,opiodconsumer,This is my post lol. But good luck nonetheless,1,1667659297.0,This is my post lol. But good luck nonetheless,0.0217391304347826,9,9,Positive
iv4qqn9,ymdl7x,applestocks,CrackLinesBelfort,I almost hit the buy button at $134.5 yesterday and now I’m regretting not doing it. But I’m also worried it’ll go back down Monday.,1,1667635822.0,I almost hit the buy button at $134.5 yesterday and now I’m regretting not doing it. But I’m also worried it’ll go back down Monday.,0.053030303030303,25,24,Negative
j0i373c,ymdl7x,applestocks,davidbracetty,What app is this on?,1,1671222033.0,What app is this on?,0.05,5,5,Neutral
iti03bn,yboid6,applestocks,junior9090,If I have to guess it’s pretty much expected every year over the past 10-15 years people expect a new model of iPhone every year so it’s not very shocking… now suppose tomorrow they announce an electric car will be released next year I’m sure that would cause a massive spike,3,1666555487.0,If I have to guess it’s pretty much expected every year over the past 10-15 years people expect a new model of iPhone every year so it’s not very shocking… now suppose tomorrow they announce an electric car will be released next year I’m sure that would cause a massive spike,0.0181818181818181,51,46,Positive
jgyn2cr,yboid6,applestocks,mjk67,"Because there are only small incremental improvements each year...

To move a stock the size of APPL, you need a game changer --- a new product line, for example.",1,1681955501.0,"Because there are only small incremental improvements each year...

To move a stock the size of APPL, you need a game changer --- a new product line, for example.",0.0555555555555555,29,27,Positive
iqz2j8g,xv2l2i,applestocks,crankthatjose,Is this a put?,1,1664854421.0,Is this a put?,0.0714285714285714,4,4,Neutral
iqz5n6u,xv2l2i,applestocks,Fresh_Bumblebee9741,Yes sir 👍,1,1664856159.0,Yes sir 👍,0.1111111111111111,3,3,Positive
iqgtps4,xrss7r,applestocks,divin31,"I see the market failing even more. I've been preparing and saving money for this for a year now.  
If you accept a suggestion, don't do hasty decisions. This will likely persist even in 2023.  
My strategy is to split up my saved money and keep buying whenever it reaches a new low. 
This is a patience game.",2,1664517294.0,"I see the market failing even more. I've been preparing and saving money for this for a year now.  
If you accept a suggestion, don't do hasty decisions. This will likely persist even in 2023.  
My strategy is to split up my saved money and keep buying whenever it reaches a new low. 
This is a patience game.",0.029126213592233,58,49,Positive
jmzo5ma,xrss7r,applestocks,Americasycho,"Social media reactions are already shit.  $3,000 price tag has people at a hard pass already.",2,1685974336.0,"Social media reactions are already shit.  $3,000 price tag has people at a hard pass already.",0.043010752688172,16,16,Negative
iqgpmv8,xrss7r,applestocks,Abject_Mulberry_5977,Edit: Its at 142 at the moment but tomorrow could be another day. Do you it will stay or go up or go to around 130 like in june,1,1664514471.0,Edit: Its at 142 at the moment but tomorrow could be another day. Do you it will stay or go up or go to around 130 like in june,0.0157480314960629,29,26,Positive
iu33ueh,xrss7r,applestocks,Suspicious-mo,"I guess that's how long you want to hold the stock.  I think anywhere in the $140.00 is a good deal for Apple.  I am long term now since the 80's, I believe  I'm called a Bag-Holder.  Apple takes beating after beating on their ability to  still be a growth stock.  It has dipped several times since it opened, but it is a long term performing investment.  They spend a lot on R&D and my not be the first to the market on new product productions, but this actually has proven very beneficial to their stockholders.  If you even put $3000.00 into Apple now and held for retirement $$, you'll have over 1 million.  Long term.  I'd also check out NVDA long term too.",2,1666933079.0,"I guess that's how long you want to hold the stock.  I think anywhere in the $140.00 is a good deal for Apple.  I am long term now since the 80's, I believe  I'm called a Bag-Holder.  Apple takes beating after beating on their ability to  still be a growth stock.  It has dipped several times since it opened, but it is a long term performing investment.  They spend a lot on R&D and my not be the first to the market on new product productions, but this actually has proven very beneficial to their stockholders.  If you even put $3000.00 into Apple now and held for retirement $$, you'll have over 1 million.  Long term.  I'd also check out NVDA long term too.",0.039274924471299,124,89,Positive
iu36eg1,xrss7r,applestocks,Suspicious-mo,"All has to do with your gain/ time expections.  So if you are asking if Apple is worth $142.00 my answer is YES.  However  if  you think it is worth $130.00 then don't BUY, because you are a short trader. I'm not sure it will go that low again unless the whole market lowers.   No one knows what outside factors can disrupt our financial security and cause volatility in short term .. Market manipulation.   Researching data on Apple  for over 40 years has always proved to me that they backup strategies for every scenario.  The Niche they went after everyone laughed at long ago.   Personal computers, reminds me of the OEM's and EV/AI  start ups today.  Now who are Apple's supplier's in this new product?  Check the Patents.  There's the company, I'd also invest in.",2,1666934808.0,"All has to do with your gain/ time expections.  So if you are asking if Apple is worth $142.00 my answer is YES.  However  if  you think it is worth $130.00 then don't BUY, because you are a short trader. I'm not sure it will go that low again unless the whole market lowers.   No one knows what outside factors can disrupt our financial security and cause volatility in short term .. Market manipulation.   Researching data on Apple  for over 40 years has always proved to me that they backup strategies for every scenario.  The Niche they went after everyone laughed at long ago.   Personal computers, reminds me of the OEM's and EV/AI  start ups today.  Now who are Apple's supplier's in this new product?  Check the Patents.  There's the company, I'd also invest in.",0.0376623376623376,135,112,Positive
iu3kv97,xrss7r,applestocks,divin31,"We don't know what the future brings and where will Apple stock prices go for sure, but it looks promising to me. I'm investing around half of my money into Apple, and the rest is split into different stocks.  
I'm getting more and more signs that a market crash will soon occur. 2022 Q3 GDP looks like the same dead cat jump that happened before every recessions in the past.  

Honesty I'm not really into NVDA. Possibly I'm wrong, but I don't like how the company operates and their policies. Before I invest into a company, I want to see more potential in it and their products.",1,1666946592.0,"We don't know what the future brings and where will Apple stock prices go for sure, but it looks promising to me. I'm investing around half of my money into Apple, and the rest is split into different stocks.  
I'm getting more and more signs that a market crash will soon occur. 2022 Q3 GDP looks like the same dead cat jump that happened before every recessions in the past.  

Honesty I'm not really into NVDA. Possibly I'm wrong, but I don't like how the company operates and their policies. Before I invest into a company, I want to see more potential in it and their products.",0.0292096219931271,107,78,Negative
iub647h,xrss7r,applestocks,Suspicious-mo,"Yes the second stock I do agree, things have become a bit questionable.  I hope you bought on Friday.  Up $10.00  should keep rising with dips I think around Thanksgiving then rises again anywhere after December 10.  But check history.",1,1667087676.0,"Yes the second stock I do agree, things have become a bit questionable.  I hope you bought on Friday.  Up $10.00  should keep rising with dips I think around Thanksgiving then rises again anywhere after December 10.  But check history.",0.0297872340425531,40,38,Positive
iogdzu2,xecbgc,applestocks,Unknown,Good. Now do it again with ur entire portfolio,2,1663193757.0,Good. Now do it again with ur entire portfolio,0.0217391304347826,9,9,Positive
ima6vfu,x0nukx,applestocks,Ok-Buy-9777,"See it as buying opertunity, apple is a solid company",2,1661795110.0,"See it as buying opertunity, apple is a solid company",0.0188679245283018,10,10,Positive
imatzw9,x0nukx,applestocks,Professional-Nerve90,it moves like a turtle..,1,1661804686.0,it moves like a turtle..,0.0833333333333333,5,5,Positive
ip0vhsm,x0nukx,applestocks,Suspicious-mo,"I'm a Bagholder, so this stock has worked for me.",1,1663560704.0,"I'm a Bagholder, so this stock has worked for me.",0.0612244897959183,10,10,Neutral
ip1dhk1,x0nukx,applestocks,ChrisMartins001,"I bought at 159, so I;m in the green now.",1,1663573567.0,"I bought at 159, so I;m in the green now.",0.073170731707317,10,10,Neutral
iljo2xl,v8h1ce,applestocks,Delicious-Bat7492,Lifetime buyer of AAPL and would love to help!,2,1661309821.0,Lifetime buyer of AAPL and would love to help!,0.0217391304347826,9,9,Positive
ihh2edd,v8h1ce,applestocks,ViewtifulGib,I’ve got July 29th calls,1,1658684960.0,I’ve got July 29th calls,0.0416666666666666,5,5,Neutral
i5rds6s,u9g83r,applestocks,IrishWhiskey1989,"I appreciate the optimism, but any particular reason why you feel this way?",3,1650641569.0,"I appreciate the optimism, but any particular reason why you feel this way?",0.0266666666666666,13,13,Positive
i5r60ct,u9g83r,applestocks,Repulsive-Ad1264,Will definitely shoot up EOD. Waiting to be rich!,1,1650638476.0,Will definitely shoot up EOD. Waiting to be rich!,0.0408163265306122,9,9,Positive
iamtbux,u9g83r,applestocks,2894246858,What's going on with your current stock holdings?,1,1653977325.0,What's going on with your current stock holdings?,0.0408163265306122,8,8,Neutral
i5r6arn,u9g83r,applestocks,MutedAerie1817,Get in that call,1,1650638592.0,Get in that call,0.0,4,4,Neutral
i3oe0hk,tx6sfh,applestocks,Caro_Quintaro,Looking bad for apple in the short term,1,1649278370.0,Looking bad for apple in the short term,0.0,8,8,Negative
i2i4bnh,tqhfhm,applestocks,diecorporations,"No time to watch. 
Why ????",1,1648512319.0,"No time to watch. 
Why ????",0.1851851851851851,6,6,Negative
j89ifvt,tqd9c7,applestocks,hightimesinaz,"What would this mean legally? If you didn’t own your phone, does Apple own the images and everything you do on it?  So many “what if’s”",1,1676223782.0,"What would this mean legally? If you didn’t own your phone, does Apple own the images and everything you do on it?  So many “what if’s”",0.0518518518518518,26,24,Positive
i272vv6,tk792x,applestocks,Wrong_Analyst_5184,"After rethinking I actually think I would start a Roth IRA. Take the 10k, put 6000 in to max out the year. Buy as many shares as you can of the S&P 500. Put 2,500 into a savings account or brokerage, don’t touch it unless an emergency happens (injury, loss of job, etc.) then with the last 1,500 use that for whatever you want, still don’t blow it though lol",3,1648305393.0,"After rethinking I actually think I would start a Roth IRA. Take the 10k, put 6000 in to max out the year. Buy as many shares as you can of the S&P 500. Put 2,500 into a savings account or brokerage, don’t touch it unless an emergency happens (injury, loss of job, etc.) then with the last 1,500 use that for whatever you want, still don’t blow it though lol",0.0446927374301676,70,60,Negative
i1oqnnr,tk792x,applestocks,lerloons_lerloons,"cash , and buy 5k of apple stocks and keep 5k in cash . 

cash is king .",1,1647970542.0,"cash , and buy 5k of apple stocks and keep 5k in cash . 

cash is king .",0.0416666666666666,18,13,Neutral
i1s311d,tk792x,applestocks,AktienNoob,depends on your life situation... for me its like the 70 / 30 portfolio,1,1648033211.0,depends on your life situation... for me its like the 70 / 30 portfolio,0.056338028169014,14,14,Positive
i1s31ih,tk792x,applestocks,AktienNoob,i go for 70% stocks,1,1648033219.0,i go for 70% stocks,0.0526315789473684,5,5,Neutral
i2124tu,tk792x,applestocks,Signal-Swim-9860,apple go~ go,1,1648184237.0,apple go~ go,0.0833333333333333,3,3,Neutral
i2727ut,tk792x,applestocks,Wrong_Analyst_5184,"I would take the 10k, buy 20 shares of Apple which will be just under 3,500 dollars. Then keep the rest of the cash but don’t just blow it lol",1,1648305086.0,"I would take the 10k, buy 20 shares of Apple which will be just under 3,500 dollars. Then keep the rest of the cash but don’t just blow it lol",0.028169014084507,30,26,Positive
i4pk5ee,tk792x,applestocks,Key_Cut_1724,Apple split had created millionaires,1,1649949282.0,Apple split had created millionaires,0.0,5,5,Positive
iarcuyg,tk792x,applestocks,2894246858,what happened to your stock,1,1654066785.0,what happened to your stock,0.0,5,5,Neutral
idgkduf,tk792x,applestocks,CardInitial7778,Hey can anyone give me advice if I should buy 10 shares of apple? I have 10 shares of Amazon and I’ll have 10 shares of google after split I dca into voo and schd for long term and wanted to get in on a few individual stocks I like is it worth it to buy 10 shares of apple ? Or any company for that matter ?,1,1656007937.0,Hey can anyone give me advice if I should buy 10 shares of apple? I have 10 shares of Amazon and I’ll have 10 shares of google after split I dca into voo and schd for long term and wanted to get in on a few individual stocks I like is it worth it to buy 10 shares of apple ? Or any company for that matter ?,0.013029315960912,68,48,Positive
i0l073r,tdk370,applestocks,Timzombiekill1,Bought the dip Friday after hours,4,1647234596.0,Bought the dip Friday after hours,0.0,6,6,Neutral
i297961,tdk370,applestocks,LGW13,Try  r/AAPL  There seems to be few posts here for some reason.,1,1648339683.0,Try  r/AAPL  There seems to be few posts here for some reason.,0.032258064516129,12,12,Neutral
i0l0it7,tdk370,applestocks,Caro_Quintaro,I got calls for this week,4,1647234816.0,I got calls for this week,0.0,6,6,Neutral
i0l2s4z,tdk370,applestocks,Timzombiekill1,Good luck ! I got burned too many times on calls,0,1647236397.0,Good luck ! I got burned too many times on calls,0.0208333333333333,11,11,Positive
hw9xhys,sme6z4,applestocks,lerloons_lerloons,"is ""trading view "" in reddit or do you mean google it ?",1,1644440215.0,"is ""trading view "" in reddit or do you mean google it ?",0.0545454545454545,13,13,Neutral
hw9wtvy,sme6z4,applestocks,Evening-Cap4065,"Oh my brother, you own Apple for 6-12 months your forced to make profit. It’s just gonna happen it’s factual. 
The only way you won’t make profit is if we go to war with Russia because the market will crash. 
Besides that .. check out “trading view” and type in AAPL .. that’s Apple ! You can see there slow but steady growth over the months. Love Apple & it’s stock!",1,1644439971.0,"Oh my brother, you own Apple for 6-12 months your forced to make profit. It’s just gonna happen it’s factual. 
The only way you won’t make profit is if we go to war with Russia because the market will crash. 
Besides that .. check out “trading view” and type in AAPL .. that’s Apple ! You can see there slow but steady growth over the months. Love Apple & it’s stock!",0.0544959128065395,71,63,Positive
hrpdy6z,rygh4x,applestocks,lockieluke3389,pretty much just Samsung,2,1641597273.0,pretty much just Samsung,0.0,4,4,Positive
hq8icxa,rpyv6z,applestocks,Opposite_Steak_4032,"I agree.  Apple will be at $257.00 in early and late 3/2022, just my thoughts",2,1640663841.0,"I agree.  Apple will be at $257.00 in early and late 3/2022, just my thoughts",0.0649350649350649,15,15,Positive
htv6m19,rgcaw2,applestocks,harderthan666,"Yeah well the thirteen is, just alright, and that is the thing they are just alright, I got PUTS for Monday",1,1642934012.0,"Yeah well the thirteen is, just alright, and that is the thing they are just alright, I got PUTS for Monday",0.02803738317757,21,18,Positive
hoik4hl,rg0aup,applestocks,esp211,"I think people will continue to flock to AAPL as a safe haven. I do think that due to broad market forces the stock price may go down in the near term but once everything stabilizes, it should go up to 200 by next year.",3,1639492926.0,"I think people will continue to flock to AAPL as a safe haven. I do think that due to broad market forces the stock price may go down in the near term but once everything stabilizes, it should go up to 200 by next year.",0.0136986301369863,45,38,Positive
hopzwoc,rg0aup,applestocks,PriorBirthday,Funny that today hit 180,1,1639617611.0,Funny that today hit 180,0.0,5,5,Positive
hoeq9yt,rfmend,applestocks,CrackLinesBelfort,"JP Morgan raises AAPL price target to $210 over potential 5G iPhone SE launch
https://appleinsider.com/articles/21/12/13/jp-morgan-raises-aapl-price-target-to-210-over-potential-5g-iphone-se-launch",2,1639420013.0,"JP Morgan raises AAPL price target to $210 over potential 5G iPhone SE launch
https://appleinsider.com/articles/21/12/13/jp-morgan-raises-aapl-price-target-to-210-over-potential-5g-iphone-se-launch",0.116751269035533,15,15,Positive
